{"schema_version":1,"kind":"infiniswap.provider-status","provider":{"provider_id":"provider-a","state":"healthy","active_connections":1},"pools":[{"name":"opportunistic","max_chunks":24,"allocated_chunks":10,"assigned_chunks":6,"available_chunks":12},{"name":"committed","max_chunks":8,"allocated_chunks":0,"assigned_chunks":0,"available_chunks":4}],"chunks":{"size_bytes":1073741824,"host_reserve_chunks":8,"allocated_chunks":10,"assigned_chunks":6,"quarantined_chunks":0},"consumers":[{"consumer_id":"consumer-a","state":"ready","mode":"backed","pool":"opportunistic","failure_deadline_ms":2000,"connection_count":0,"assigned_opportunistic_chunks":6,"assigned_committed_chunks":0,"inflight_control_requests":1,"last_error_code":0}],"metrics":{"admissions_total":9,"admission_rejections_total":2,"pressure_reclaims_total":0,"authentication_failures_total":1,"deadline_expiries_total":3,"connections_total":0,"disconnections_total":0,"control_errors_total":0},"last_error":{"code":"host_reserve"}}
